quote,author,category
I am a citizen of the world.,"Diogenes of Sinope, The Lives and Opinions of Eminent Philosophers","cynicism, philosophy"
For every expert there is an equal and opposite expert.,"Jasper Fforde, One of Our Thursdays Is Missing",philosophy
"By what men think, we create the world around us, daily new.","Marion Zimmer Bradley, The Mists of Avalon","belief, faith, philosophy"
Neither the sun nor death can be looked at steadily.,François de La Rochefoucauld,"death, life, philosophy, sun"
Patience is the only way you can endure the gray periods.,"Teri Hatcher, Burnt Toast: And Other Philosophies of Life","actresses, inspirational, motivation, philosophy"
All things fade and quickly turn to myth.,"Marcus Aurelius, Meditations",philosophy
the serpent if it wants to become the dragon must eat itself.,Francis Bacon,"bacon, philosophy"
I have forgotten my umbrella. ,Friedrich Nietzsche,"aphorism, derrida, interpretation, philosophy"
What a lover’s heart knows let no man’s brain dispute.,"Aberjhani, Visions of a Skylark Dressed in Black","famous-author, famous-poet, hope-and-despair, inspiration, inspirational-quotes, intellectualism, intuition, love, lovers, philosophy, spirituality, valentine-s-day, wisdom"
"Life's managed, not cured. ",Phillip C. McGraw,"inspiration, inspirational, life, philosophy, psychology, self-help, wisdom"
Forgiveness is created by the restitution of the abuser, of the wrongdoer. It is not something to be squeeeeeezed out of the victim in a further act of conscience-corrupting abuse.,Stefan Molyneux
Few things are more deceptive than memories.,"Carlos Ruiz Zafón, The Shadow of the Wind","memory, philosophy, truth"
"If a man who can’t count finds a four leaf clover, is he lucky?",Stanisław Lem,philosophy
The best things in life are crazy.,"Emme Rollins, Dear Rockstar","crazy, new-adult, new-adult-romance, philosophy, rock-star, rockstar, rockstars"
What if nobody showed up at Armageddon?,C.R. Strahan,"apocalypse, humor, inspiration, philosophy"
..the most dangerous animal in a zoo is Man.,"Yann Martel, Life of Pi","animals, mankind, philosophy, truth"
To win true freeedom you must be a slave to philosophy.,"Seneca, Letters from a Stoic",philosophy
It doesn't matter how smart you are unless you stop and think.,Thomas Sowell,"philosophy, politics"
All actual life is encounter.,Martin Buber,philosophy
"Anyone who fights for the future, lives in it today.",Ayn Rand,"idealism, philosophy"
Why' is a crooked letter and can't be made straight.,"Stephen King, The Gunslinger",philosophy
A writer always writes.,Don Roff,"philosophy, writer, writing"
All my problems bow before my stubbornness.,"Amit Kalantri, Wealth of Words","bow, confidence, human, humans, inspiration, inspirational, inspirational-quotes, motivation, motivational, motivational-quotes, philosophy, problem-solving, problems, respect, respectable, respected, respectful, respecting, respecting-others, respecting-yourself, self-respect, stubborn, stubborness, stubbornly, stubbornness, wisdom, wisdom-quotes"
High thoughts must have high language.,"Aristophanes, Frogs and Other Plays",philosophy
Is it better to be loved or feared?,"Niccolò Machiavelli, The Prince","philosophy, political-philosophy"
Love is a cowboy's hardest ride.,C.B. Smith,philosophy
"I'll follow you, even to death—but I won't live with you any more.","Prosper Mérimée, Carmen","commitment, death, life, philosophy"
"Don't think, but look! (PI 66)",Ludwig Wittgenstein,"carpe-diem, philosophy, wittgenstein"
All religions are based on obsolete terminology.,"Vladimir Nabokov, Pale Fire","faith, philosophy, philosophy-of-religion, religion, theology, translation"
"The free mind, unafraid of labor, presses on to attain the good.","Laura Cereta, Collected Letters of a Renaissance Feminist","feminism, mind, philosophy, truth"
The only value of wasted time is knowledge.,"Monica Drake, Clown Girl","inspirational, knowledge, philosophy, wasted-time"
Even if you are alone you wage war with yourself.,"Dejan Stojanovic, The Sun Watches the Sun","alone, books, dejan-stojanovic, literature, literature-quotes, philosophy, poetry, poetry-quotes, poets, quotes, the-sun-watches-the-sun, war, wars, wisdom, yourself"
"Love, I think, is a gateway to the world, not an escape from it.",Mark Doty,"feelings, life, living, love, philosophy"
"We do not create life, we create death.",Marie Symeou,"dark-thoughts, deep-thoughts, philosophy, realistic"
You cannot connect with anyone except through reality.,Stefan Molyneux,"connection, delusion, friendship, people, philosophy, psychology, rationality, relations, relationships"
"If your desire is for good, the people will be good.",Confucius,"confucianism, confucius, philosophy, political, politics"
God is an ever-receding pocket of﻿ scientific ignorance.,Neil deGrasse Tyson,"atheism, philosophy, religion, science, skepticism"
What we cannot bear removes us from life, what remains can be borne.,"Marcus Aurelius, Meditations"
He who conquers himself is the mightiest warrior.,Confucius,"ancient, ancient-china, ancient-chinese, body, chinese, conquers, fighting, inspirational, philosophical, philosophy, proverb, self-improvement, self-realization, training, warrior"
Pursue not the outer entanglements, Dwell not in the inner void, Be serene in the oneness of things
"Impossible things are really rough to do, you know.","Brandon Sanderson, Alcatraz Versus the Shattered Lens","heroics, philosophy"
"Body is a home, a prison and a grave.","James Runcie, The Colour Of Heaven","body, grave, home, philosophy, prison"
"Writing blooms flowers for mind, which last forever.",Debasish Mridha,"blooms, debasish, flowers, forever, life, mind, mridha, philosophy, writing"
Having just enough life to enjoy being dead.,"Jim Holt, Why Does the World Exist?: An Existential Detective Story","existentialism, nirvana, philosophy"
"If I had to live my life over, I'd live over a saloon.",W.C. Fields,"drinking, non-sequitur, philosophy"
"In truth, Freud sees nothing and understands nothing.","Gilles Deleuze, A Thousand Plateaus: Capitalism and Schizophrenia","freud, humor, philosophy, psycoanalysis"
I drink cup of sunlight every morning to brighten myself.,Debasish Mridha,"brighten, education, happiness, hope, inspirational, intelligence, knowledge, life, love, morning, philosophy, sunlight, truth, wisdom"
There is no key to open the heart of another - except curiosity.,Stefan Molyneux,"contact, empathy, friendship, happiness, life, mindfulness, philosophy, psychology, relationships, self-knowledge"
"The better organized the state, the duller its humanity.","David Mitchell, Cloud Atlas","humorous, philosophy"
"This place has only three exits, sir: Madness, and Death.","René Daumal, A Night of Serious Drinking","insanity, madness, philosophy, surrealism"
Words are the clothes thoughts wear.,Samuel Beckett,"language, philosophy, thinking, words"
Call no man happy until he is dead.,Solon,"greek, happiness, history, philosophy, the-good-life"
Is it better to go with the flow or let the flow go?,"Aidan Chambers, Postcards from No Man's Land","philosophy, questions"
let the speaker speak truly and the judge decide justly.,"Plato, Euthyphro. Apology. Crito. Phaedo. Phaedrus.",philosophy
Hope burns eternal in the human heart.,O.R. Melling,philosophy
Conformity to the present is invisibility to the future.,Stefan Molyneux,"advancement, evolution, freedom, improvement, innovation, philosophy, progress"
Violence begins with the fork.,Mahatma Gandhi,"gandhi, philosophy, veganism"
We youths say “like” all the time because we mistrust reality.,"James S. Kunen, The Strawberry Statement: Notes of a College Revolutionary","philosophy, politics, youth"
The brightest light casts the darkest shadow.,"Jess C. Scott, The Darker Side of Life","author, books, cyberpunk, dark, dark-elves, ego, elves, fantasy, fiction, future, future-present, life, light, philosophy, series, urban-fantasy, wisdom"
There is no fate which cannot be surmounted by scorn.,Albert Camus,philosophy
"It's not oil that runs the world, it's shame.","Sherman Alexie, War Dances","philosophy, racial-politics, social-commentary"
"You were free, you are free and you will be free.",Santosh Kalwar,"death, free, freedom, life, philosophy"
Socrates should have written comics.,Mark Waid,"comics, philosophy, socrates"
Sitting still is a pain in the ass.,"Noah Levine, Against the Stream: A Buddhist Manual for Spiritual Revolutionaries","buddhism, meditation, philosophy, religion"
"I grew up once, I decided never to do it again","Benny Bellamacina, The King of Rhyme","famous-quotes, humor, life, philosophy"
"To stay or to go, it amounted to the same thing.","Albert Camus, The Stranger","absurd, choices, existentialism, philosophy"
Treat everyone you meet as if they were you.,Doug Dillon,"identity, inspiration, mindfulness, people, philosophy"
The truth is helpless when up against perception,Zack W. Van,"life, perception, philosophy, truth, zack-w-van"
All statistics have outliers.,"Nenia Campbell, Terrorscape","chance, life, outlier, philosophy, probability, statistics"
When the heart is dry the eye is dry.,"Victor Hugo, Les Misérables - anthology","heart, philosophy, tears"
"Resources are hired to give results, not reasons.","Amit Kalantri, Wealth of Words","amit-kalantri, amit-kalantri-quotes, appoint, appointment, business, business-quotes, company, complaining, complaints, corporate, employee, employees, employment, hire, hiring, hr, human, human-resource, human-resources, humans, inspiration, inspirational, inspirational-quotes, job, mangement, motivation, motivational, motivational-quotes, philosophy, reason, reasons, resource, resources, result, results, wisdom, wisdom-quotes, work, workman, workmanship"
The logical man must either deny all miracles or none.,"Charles Alexander Eastman, The Soul of the Indian","logic, miracle, philosophy"
There's no greater show on earth than observing human nature,"Benny Bellamacina, Little Luigi: A Musical Adventure","life, love, philosophy, wisdom"
What is food to one man is bitter poison to others,Titus Lucretius Carus,"lucretius, philosophy"
"What comes, is called.","Ki Longfellow, Flow Down Like Silver: Hypatia of Alexandria","christian-history, hypatia-of-alexandria, mathematics, philosophy, spirituality"
"But only he who, himself enlightened, is not afraid of shadows.","Immanuel Kant, An Answer to the Question: What Is Enlightenment?","life, philosophy"
Beauty as we feel it is something indescribable, what it is or what it means can never be said.,George Santayana
I think it was the institution...I was trying to master it.,"E. Lockhart, The Disreputable History of Frankie Landau-Banks","institution, master, mental, obsession, philosophy, strong"
"Omnia vincit amor"" - ""Love conquers all",Virgil,"love, philosophy"
Cheapen words and they'll cheapen you,Benny Bellamacina,"life, philosophy, poetry, wisdom"
"Love life, Live Love",Benny Bellamacina,"life, love, peoms, philosophy, poetry"
Education is meaningless without manners,"Benny Bellamacina, Piddly Poems for Children, v.2","inspirational, life, philosophy"
Ideas are the source of all things,Plato,"intellect, knowledge, life, philosophy, wisdom"
Disobedience is the true foundation of liberty.,Henry David Thoreau,"disobedience, free-thinking, free-will, freedom-of-expression, liberty, philosophy, protest"
"A smiling lie is a whirlwind, easy to enter, but hard to escape.","Dejan Stojanovic, The Sun Watches the Sun","books, dejan-stojanovic, escape, lie, lies, literature, literature-quotes, philosophy, poetry, poetry-quotes, poets, quotes, smiling, the-sun-watches-the-sun, whirlwind, wisdom"
İnsanoğlu nedense anlayamadığı şeylere kötülemeye meyilli.,Elif Shafak,"experience, imagination, life, philosophy, truth, writing"
A few dud universes can really clutter up your basement.,"Neal Stephenson, In the Beginning...Was the Command Line","humor, philosophy"
la vida sólo puede ser entendida mirando hacia atrás, aunque deba ser vivida mirando hacia adelante,Søren Kierkegaard
Every science begins as philosophy and ends as art, it arises in hypothesis and flows into achievement.,Will Durant
Deep connection is the antidote to madness.,Stefan Molyneux,"abuse, abuse-survivors, freedom, philosophy, psychology, trauma"
"Don't write to sell, write to tell.",Jonas Eriksson,"philosophy, writing"
A culture is made — or destroyed — by its articulate voices.,Ayn Rand,philosophy
By that which you kill are you bound.,"O.R. Melling, The Summer King",philosophy
Never say never,Charles Dickens,"inspirational, philosophy"
"I care for no man on earth, and no man on earth cares for me.","Charles Dickens, A Tale of Two Cities","a-tale-of-two-cities, alone, charles-dickens, depressed, depression, dickens, life, lonely, philosophy, sad, self-loathing, self-worth, sydney-carton"
Is it possible for a man to move the earth? Yes, but he must first find out another earth to stand upon.,Jeremy Bentham
Pride makes us artificial, humility makes us real,Thomas Merton
Life is a book. We fill the pages.,Victoria Valentine,"life, love, philosophy, romance"
Lend me your ears and you can borrow my mind,"Benny Bellamacina, The King of Rhyme","humor, life, philosophy"
Her maktul katilinde yaşamaya devam eder.,Elif Shafak,"experience, imagination, life, philosophy, truth, writing"
Knowledge becomes evil if the aim be not virtuous.,Plato,"knowledge, morality, philosophy"
The greatest untold story is the evolution of God.,G.I. Gurdjieff,"philosophy, spirituality"
Step out of my sunlight.,Diogenes Laërtius,philosophy
"For others, in spite of myself, from myself.",Emmanuel Levinas,"humor, inspirational, philosophy"
Moments are the elements of profit,"Karl Marx, Capital, Vol 1: A Critical Analysis of Capitalist Production","economics, philosophy"
Philosophy is not a spectator sport.,"Nigel Warburton, Philosophy","active, philosophy, spectator, sport"
The world was floods above and fire below,"Gregory Maguire, Wicked: The Life and Times of the Wicked Witch of the West","life, philosophy"
Absurdity is the ecstasy of intellectualism.,"Criss Jami, Salomé: In Every Inch In Every Mile","absurd, absurdity, art, artist, ecstasy, experiment, experimentation, insane, insanity, intellectual, intellectualism, intelligence, madness, mind, out-of-my-mind, outrageous, philosophy, theory, thinking, thought, too-much"
"Live like a tree, giving, forgiving and free.",Debasish Mridha,"forgiving, giving, life, love, philosophy, tree, truth"
Language disguises thought.,"Ludwig Wittgenstein, Tractatus Logico-Philosophicus","linguistics, logic, philosophy, semiotics"
Who we are now is all that really matters.,"Amy Joy, The Academie","inspirational, philosophy, zen"
"This is your life, and its ending one minute at a time.","Chuck Palahniuk, Fight Club","philosophy, tyler, tyler-durden"
Poverty is a virtue which one can teach oneself.,Diogenes of Sinope,"cynicism, philosophy"
The perfect is the enemy of the good.,Voltaire,philosophy
Raise a smile and lower stress,Benny Bellamacina,"humor, life, philosophy, wisdom"
You have to be an artist and a madman...,"Vladimir Nabokov, Lolita","inspirational, life, philosophy, truth-of-life"
It’s not easy to write a poem about a poem.,Dejan Stojanovic,"books, dejan-stojanovic, literature, literature-quotes, philosophy, poems, poetry, poetry-quotes, poets, quotes, the-sun-watches-the-sun, wisdom, writing"
Don't hate the media, become the media.,"Jello Biafra, Become the Media"
Charity is no substitute for justice withheld.,Augustine of Hippo,"inspirational, morality, philosophy, religion"
"It is culture that is the bully.""",Sharon  Lee,"culture, philosophy, sociology"
Astonishment is the root of philosophy.,Paul Tillich,philosophy
All beings so far have created something beyond themselves, and do you want to be the ebb of this great flood and even go back to the beasts rather than overcome man? What is the ape to man? A laughingstock or a painful embarrassment. And man shall be just that for the overman: a laughingstock or a painful embarrassment…,"Friedrich Nietzsche, Thus Spoke Zarathustra"
The easiest way to be reborn is to live and feel life everyday,Munia Khan,"born, born-again, easiest, easy, everyday, everyday-quotes, feel, life, life-and-death, life-and-living, life-experience, life-philosophy, life-quotes, live, philosophy, reborn, way, wisdom, wisdom-inspirational, wisdom-quotes"
Some of us are busy doing things, some of us are busy complaining.,Debasish Mridha
Good authors worry about genres great authors don't.,Frank X. Gaspar,"frank-gaspar, good-author, great-author, mg-hardie, philosophy"
To conquer oneself is the best and noblest victory, to be vanquished by one's own nature is the worst and most ignoble defeat.,Plato
A lie never grows old.,"Sophocles, White Lies","life, philosophy, quote"
The cinema is truth 24 frames-per-second,Jean-Luc Godard,"film, philosophy"
Life is like yoga, the only way you can enjoy it is by relaxing into any position you happen to find yourself in.,"Jon Wakeham, Troubled Waters"
"For a game, you don’t need a teacher.","Dejan Stojanovic, The Sun Watches the Sun","books, dejan-stojanovic, game, games, literature, literature-quotes, philosophy, poetry, poetry-quotes, poets, quotes, teacher, teachers, the-sun-watches-the-sun, wisdom"
Those who do not think bout the future cannot have one.,Michael J. Kami,"philosophy, wisdom"
Never say no to now,"Benny Bellamacina, Piddly poems for children vol:3","humour, humourous, life, philosophy, wisdom"
Ignore a person kill the person.,M.Azeem Talib,philosophy
A stone is heavy and the sand is weighty, but a fool's wrath is heavier than them both.,"Frank Herbert, Dune"
True knowledge exists in knowing that you know nothing.,Socrates,philosophy
"I think I exist, therefore I exist. I think.","David Gerrold, The Man Who Folded Himself","funny, philosophy"
"We're on a planet, relax!","Benny Bellamacina, Piddly Poems for Children, v.2","humor, philosophy, wisdom"
A constitution that is made for all nations is made for none.,Joseph de Maistre,"philosophy, politics"
Light in comparison with darkness is a void.,Vladimir Nabokov,philosophy
You must go on.I can’t go on.I’ll go on.,"Samuel Beckett, The Unnamable","life, literature, philosophy"
Love is my inner strength and my power.,Debasish Mridha,"education, happiness, hope, inspirational, intelligence, knowledge, life, love, philosophy, quotes, truth, wisdom"
Be kind. It will reveal your true inner beauty.,Debasish Mridha,"be-kind, buddha, debasish-mridha, debasish-mridha-md, gandhi, inner-beauty, inspirational, miraboli, oscar-wilde, philosophy, quotes, tagore, true-beauty"
Art is whatever you can get away with.,"Marshall McLuhan, The Medium is the Massage","art, communications, media, philosophy"
Be a worthy worker and work will come.,"Amit Kalantri, Wealth of Words","adage, advertisement, alliterations, amit-kalantri, amit-kalantri-quotes, amit-kalantri-writer, artist, assignment, associate, blog, blogging, book-writing, business, catch-lines, catchphrases, characters, closing-deal, contracts, craftsmanship, creative-writing, deal, efficiency, employee, essay, inspirational, knowledge, labor, laborer, labour, labourer, motivational, movie, movie-dialogue, novel-writing, philosophy, project, projects, proverbs, public-speaking, punchline, quality, quotes, rhetoric, script, script-writing, scriptwriting, serviceman, skill, slogans, social-networking, speech, speechwriting, story, tag-lines, union, wisdom, work, worker, workman, workmanship, worthy, writing"
"After your death, you will be what you were before your birth.",Arthur Schopenhauer,"afterlife, birth, death, life, life-after-death, metaphysics, philosophy"
One does what one is, one becomes what one does.,Robert Musil
"To be, or not to be: what a question!","E.A. Bucchianeri, Faust: My Soul Be Damned for the World: Volume I","existence, faust, funny, humor, marlowe, philosophical-humor, philosophy, philosophy-of-life, questions, questions-and-answers, questions-in-life, shakespeare, to-be-or-not-to-be"
"When your tears become invisible, disappear",Benny Bellamacina,"life, love, lovers, philosophy, relationships, wisdom"
What's the survival value of obsessing on a sunset?,"Peter Watts, Blindsight",philosophy
"Free your mind from routine, keep your brain somewhere else",Benny Bellamacina,"freedom, humor, humour, philosophy, wisdom"
"You have made the moon,"" The Jester said. ""That is the moon.","James Thurber, Many Moons","children-s-books, life, philosophy"
I Take Life Very Seriously: One Joke At A Time.,Sandra Chami Kassis,"funny, life, philosophy, quotes, truth, wisdom-inspirational"
Never let your uniqueness be compromised,Benny Bellamacina,"life, philosophy, wisdom"
We co-create our reality with others in unseen ways.,Doug Dillon,"connectivity, creation, inspiration, philosophy, reality, unseen"
Life is a complexwith real and imaginary parts,"Angela Suba, From My Pen, On Life","life, philosophy"
"True, life is complex. But so are a great many accidents.","Foz Meadows, The Key to Starveldt","complex, life, philosophy"
"MIGHT, something God only has.",A Gentlemen,"god, philosophy, relegion"
At sunrise everything is luminous but not clear.,"Norman Maclean, A River Runs Through It and Other Stories","people, philosophy, sunrise, thoughts"
The gods are fond of the cryptic and dislike the evident.,"Elizabeth Gilbert, Eat, Pray, Love","philosophy, spirituality, upanishads"
"When the road ahead seems impossible, start the engine","Benny Bellamacina, Piddly Poems for Children","humour, life, optimism, philosophy, quote, wisdom"
"As individuals express their life, so they are.","Karl Marx, The German Ideology","history, philosophy"
"For me, writing is immortality. It is wisdom. It is never-ending.",Al   Stone,"inspirational, philosophy, reality"
See the moon? It hates us.,Donald Barthelme,"pessimism, philosophy"
Suicidal glory is the luxury of the irresponsible.,"Lois McMaster Bujold, Barrayar","death, glory, philosophy, power, war"
"In my heart's most secret place,I pity them as angels do.",Sara Teasdale,"pessimism, philosophy"
Laughter is the antidote to existential pain,"S. Spencer Baker, Slabscape: Reset","aphorism, humour, pain, philosophy"
"If you think fate is fickle, try tempting it","S. Spencer Baker, Slabscape: Reset","humour, philosophy"
Every country has the government it deserves.,Joseph de Maistre,"philosophy, politics"
The rider evolved to serve to the elephant.,"Jonathan Haidt, The Happiness Hypothesis: Finding Modern Truth in Ancient Wisdom","elephant, haidt, happiness, jon, jonathan, life, mindfuckery, philosophy"
Wisdom is seeing something in a non-habitual manner.,William James,philosophy
Love delayed is lust augmented.,Louis de Bernières,philosophy
Death is never an excuse to stop living.,"Catherine Johnson, A Nest of Vipers","death, life, philosophy"
We must think beyond ourselves,"Kevin J. Anderson, A Forest of Stars","inspirational, life, love, philosophy"
Rien ne sert de courir il faut partir à point,"Jean de La Fontaine, The Fables of La Fontaine",philosophy
The world is a garden of philosophy. God is its gardener, Man is the visitor.And any tree that does not bear fruits of philosophy either does not belong tothat garden or is yet to be grown.,Kedar Joshi
Would Crazy Horse have spent this much to remodel a kitchen?,"Ian Frazier, On the Rez","humor, native-americans, philosophy"
Sublime natures are seldom clean!,"Longinus, Longinus on the Sublime: The Greek Text","anne-carson, decreation, philosophy"
I man is a prisoner of only his own mind.,Michael Hawkins,philosophy
Brahman is the ultimate reality, it is simultaneously Saguna and Nirguna, divisions are due to ignorance. Mind and intellect can never catch hold of it
At the heart of nature’s mystery lies another mystery.,"Ransom Riggs, Hollow City",philosophy
A true confession: I believe in a soluble fish.,"Charles Simic, The Unemployed Fortune-Teller: Essays and Memoirs","confession, fish, philosophy"
You need contradictions to make an ideal.,"Alex Shakar, The Savage Girl",philosophy
Pay attention to me.,Sally Quinn,"horticulture, humor, philosophy, politics"
Life is what you portrait it!,Mohammad Hossein Khosh Bayan,"life, philosophy"
Great losses are great lessons.,"Amit Kalantri, Wealth of Words","adage, advertisement, alliterations, amit-kalantri, amit-kalantri-quotes, amit-kalantri-writer, blog, blogging, book-writing, bounce-back, catch-lines, catchphrases, characters, creative-writing, essay, experience, hope, inspirational, knowledge, learning-from-mistakes, lesson, loss, mistakes, motivational, movie, movie-dialogue, novel-writing, philosophy, profit, proverbs, public-speaking, punchline, quotes, rhetoric, script, script-writing, scriptwriting, setback, slogans, social-networking, speech, speechwriting, story, success, tag-lines, wisdom, writing"
The ultimate goal of humanity is knowledge.,Abhijit Naskar,"inspiration, inspirational, knowledge, knowledge-education, knowledge-quotes, knowledge-teaching, knowledge-wisdom, philosophy, philosophy-quotes, pursuit-of-knowledge, truth, truth-of-life, wisdom-quotes, wise-quotes, wise-words, words-of-wisdom"
You don't need to look at the beauty to feel the love.,Anthony T. Hincks,"beautiful, beauty, feel, look, love, philosophy, see, touch"
Asshole Proximity Disorder,Stefan Molyneux,"abuse, bullying, child-abuse, healing, philosophy, psychology, trauma"
"A mother gives you a life, a mother-in-law gives you her life.","Amit Kalantri, Wealth of Words","after-marriage, amit-kalantri, amit-kalantri-proverb, amit-kalantri-quotes, amit-kalantri-writer, boy, daughter, family, girl, husband, in-laws, inspirational-quotes, love, matrimony, mom, mother, mother-in-law, motivational-quotes, mummy, philosophy, promise, relations, wedding-marriage, wife, wisdom"
