quote,author,category
Real joy is never influenced.,Haresh Sippy,"happiness, happiness-quotes, joy"
Happiness is my drug of choice.,Marty Rubin,"drugs, happiness"
Be kind. Be happy. Be free.,Marty Rubin,"freedom, happiness, kindness"
Hope lies in what action we take.,Auliq-Ice,"change, courage, happiness, hope, optimism, positive-attitude"
Go for the hum.,"Ethan Mordden, Pooh's Workout Book","exercise, happiness, pooh-bear, winnie-the-pooh"
Be smart. You Only Die Once -YODO,Savania China,"happiness, inspirational, life, life-lessons, life-philosophy, responsibility, self-awareness, self-improvement, success, success-strategies, survival"
Life is more than being happy, it is to impact lives and live for the good of your generation.,"Sunday Adelaja, The Mountain of Ignorance"
Give people a chance.,Scott Stabile,"happiness, hope, love, people"
Shit works out.,Scott Stabile,"happiness, inspiration, life"
Who are you not to be yourself?,Scott Stabile,"be-yourself, happiness, inspiration"
...Realization is born from error...,Janvier Chouteu-Chando,"happiness, joy, life, love"
"Do as I say, not as I do.","Swami Pranayomama, How To Not Give A F-ck In Ten Easy Steps: The Modern Lay Person's Guide To Enlightenment","happiness, humor, love, spirituality"
Reach for the heaven, seek happiness.,Lailah Gifty Akita
You are a Hero. Be Heroic. Always.,Vineet Raj Kapoor,"athlete, boost, confidence, happiness, hero, heroic, heroism, inspiration, inspire, leader, leadership, morale, motivate, motivation, success"
You are the ocean, everything else is just waves and wind.,Steve Maraboli
My dream is to keep dreaming!,Miguel Reynolds Brandao,"happiness, life, philosophy, thinking"
LIFE - Death's Very Emissary,"Abhysheq Shukla, KARMA","age, aim, anger, belief, business, change, confidence, courage, creativity, death, desire, dreams, education, failure, faith, family, fear, forgiveness, goal, god, happiness, hate, heart, history, hope, humorous, imagination, inspirational, leadership, life, loneliness, love, marriage, one-liner, opportunity, optimism, patience, patriotism, peace, philosophy, poems, politics, poverty, relationship, religion, romantic, sad, school, science, success, time, truth, ve-attitude, war, wisdom-wise, witty"
Dreamers Can.,"Toni Sorenson, The Great Brain Cleanse","accomplishments, dreamers, fitness, happiness, health, life, love, success"
I am a habitual rule-breaker,Mohadesa Najumi,"acceptance, ascension, bell-hooks, brain, connectedness, consciousness, crazy, embodiment, enlightenment, fetters, genius, happiness, heartbreak, life, loss, love, matrix, mental-power, mohadesa, mohadesa-najumi, najumi, neuroscience, normal, norms, osho, pain, philosophy, psycology, relationship, self-awareness, self-help, self-love, self-mastery, society, sociology, spirituality, third-eye, understanding"
Happiness waits for no one.,"Lisa Cypers Kamen, Are We Happy Yet?: Eight Keys to Unlocking a Joyful Life","happiness, motivational-quotes"
You do not love me, you love my success!,Compton Gage
Gratitude changes us.,"Auliq Ice, The Secret of Greatness","gratitude, happiness, thankfulness"
"Where there is love, things roll.",Auliq Ice,"happiness, humanity, love, unity"
There's just so much to live for.,"Alex George, Setting Free the Kites","happiness, hope, life"
"Be happy, not contented.",Biju Paulose,"achieve, achievement, achievements, achieving, happiness, happy, lessons, life, satisfaction, satisfied, success"
"Smile is a talent, few don't have.",saadshah,"happiness, happy-life, inpirational, inpirational-life, laughter, motivational, motivational-inspirational, smile"
"Happy Mind, Happy Home",Napa Kettle,"happiness, inspirational, motivational-quotes"
"He's like a drug for you, Bella.","Stephenie Meyer, Eclipse","drug, romance, simile"
My soul will find yours.,"Jude Deveraux, A Knight in Shining Armor",romance
thus with a kiss I die,"William Shakespeare, Romeo and Juliet","history, romance"
Stay with me.Always.,"Suzanne Collins, Mockingjay","hunger-games, katniss, mockingjay, peeta, romance"
Attraction is not an option. ,Neil Strauss,romance
It doesn’t matter where I am, I’m yours.,"Sherry Thomas, Not Quite a Husband"
Life is a book waiting to happen.,Sloan McBride,"paranormal, romance"
"Over everything, I choose you","Marissa Meyer, Heartless","couple, love, romance, romantic"
I'll love you to ruins.,"Michelle Hodkin, The Retribution of Mara Dyer","love, mara-dyer, retribution-of-mara-dyer, romance"
"Live, Princess, for me. I love You","Molly McAdams, Stealing Harper","molly-mcadams, romance, stealing-harper"
Give me some sugar.,"Rachel Gibson, Simply Irresistible","humor, romance"
There's always be a me and you.,"James Patterson, Max","love, romance"
Let me feel how thy pulses beat.,"Thomas Middleton, The Changeling","lust, romance"
He felt like home.,"JoAnne Kenrick, When A Mullo Loves A Woman","gypsy, joanne-kenrick, magic, memories, monterey, mullo, mystery, paranormal, paranormal-romance, romance, vampire, vampires, when-a-mullo-loves-a-woman"
"Will you be my forever, Donia?","Melissa Marr, Darkest Mercy","faeries, paranormal-romance, romance"
Humor was the enemy of desire.,"Arthur C. Clarke, 2010: Odyssey Two",romance
You're my wings. You made me fly.,Pepper Winters,romance
Your neck. I want to kiss it.,"Edmond Rostand, Cyrano de Bergerac",romance
He’s more myself than I am,"Emily Brontë, Wuthering Heights",romance
Your life is a book, make it a bestseller.,Shanon Grey
"Careful,"" he smiled, ""I'm lethal.","Nely Cab, Creatura","romance, romance-novels, teens, young-adult"
He loved her all he could, but he couldn't love her very much.,"Jennifer Crusie, Wild Ride"
We're all the same in the dark.,"J.J. Murray, Renee And Jay","multicultural, romance"
Love is not about lovers.,"Santosh Kalwar, You Can","inspirational, love, romance"
cinta itu punya dua sisi,Dewie Sekar,romance
Will you love me enough?,Ana Monnar,"ana-monnar, love, quote, romance"
"Never Give up, never surrender.",Nancy J. Cohen,"mystery, paranormal-romance, romance"
"My name's Sean, Jem. I'm Sean.","J.A. Belfield, Darkness & Light","destiny, fate, fiction, pack, paranormal, romance, werewolves"
"Suck on this, Edward.","Dani Smith, Black Dog and Rebel Rose","angel, demon, erotic-romance, erotica, paranormal, romance, vampire"
See me just as I see you.,"Nicholas Sparks, See Me",romance
My favorite color is you.,"Suzanne Brockmann, Born to Darkness","elliot-zerkowski, favorite-color, love, romance, stephen-diaz"
"Welcome back, Jem.","J.A. Belfield, Darkness & Light","destiny, fate, holloway, pack, paranormal, paranormal-romance, romance, urban-fantasy, werewolf, werewolves"
"Have you gone crazy?"".","Cherise Sinclair, To Command and Collar","bdsm, cherise-sinclair, erotic-romance, romance"
"Crazy got nothin on us"" Neesa",C.T. Todd,"action-adventure, drama, horror, romance, vampire"
"Okay, babe, I'm here.”","Christy Reece, Rescue Me","humour, romance, romantic-suspense"
Sexy with a capital SEX.,"Wendy Rosnau, The Right Side of the Law","intimate-moments, romance, romantic-drama, silhouette, southern-romance"
I'm not going anywhere.,"Allie Burke, Violet Midnight","enchanters, paranormal, romance, violet-midnight"
Bringing Thoughts 2 Life,Brooklen Borne,"inspirational, romance, suspense, suspense-action, suspense-drama"
I write--because I must write.,Taryn A. Taylor,"fantasy, paranormal, romance"
Love is not jealous.,"Brian Jay Corrigan, The Poet of Loch Ness","inspirational, love, romance"
Reach for the Stars!,Arsoleen Woolcock,"romance, women-s-fiction"
I am an acquired taste.,W.S. Gilbert,romance
I want to have an affair.,"Pella Grace, Knock Love Out","new-adult, romance, sexy"
It's me being me making you be you...,Nitya Prakash,"love-story, romance"
She was so light, he could hold her all night without a problem.,"Cherise Sinclair, Breaking Free"
"Gay sex, one. Straight sex, zero","Dani Alexander, Shattered Glass","funny, m-m, mystery, ofy, romance"
"Too long, much too long.","Jessica Verday, The Haunted","paranormal, romance, young-adult-fiction"
We're not mad. We're inhabited,"Sue Moorcroft, Love Writing","love-writing, romance, sue-moorcroft, writing-craft"
you roll me out flat,"D.H. Lawrence, Lady Chatterley's Lover",romance
"Be my shield, baby. Be my world","Cybill Cain, Poker Face","chimera-club-stories, cybill-cain, poker-face, romance"
Live a life worth living.,R.L. Dunn,romance
"What, Rudolph wasn’t available?","Sierra Donovan, Do Not Open 'Til Christmas","christmas, contemporary, editor, holiday, newspaper, reporters, romance, rudolph, snow"
"You, Faery Man, are wonderful.","Desiree Williams, Illusionary","faerie, faery, fairy, magic, romance, wonder, wonderful"
I am the shadow of the flame.,"Victoria Aveyard, Red Queen","fantasy, fantasy-fiction, fantasy-young-adult, redqueen, romance, wars, young-adult, young-adult-fantasy, young-adult-fiction, young-adult-romance"
I would want forever with you.,"Penny Reid, Grin and Beard It","love, passion, romance"
Zendagi Migzara,"Khaled Hosseini, The Kite Runner",romance
"Once bitten, totally smitten.","Mari Mancusi, Stake That","paranormal, romance, urban-fantasy, vampires-romance, ya"
The past is just that.,"B.J. Daniels, Dead Ringer","romance, suspense, western, western-romantic-suspense"
Isn't it lovely to be lovely me!,"Nancy Mitford, The Pursuit of Love & Love in a Cold Climate","humour, period-fiction, romance"
Hope is a waking dream.,Aristotle,"dreams, hope"
Hope costs nothing. ,Colette,"hope, inspiration"
Hope keeps you alive.,"Lauren Oliver, Before I Fall","before-i-fall, hope, lauren-oliver"
Carry the fire.,"Cormac McCarthy, The Road","darkness, emotion, hope, prophecy"
Love is only one fine star away.,Stevie Nicks,"astronomy, hope, love, stars"
There is hope in forgiveness,"John Piper, A Sweet and Bitter Providence: Sex, Race, and the Sovereignty of God","forgiveness, hope"
Hope attracts chances.,"Toba Beta, My Ancestor Was an Ancient Astronaut","attract, chances, hope"
You can break a man with hope.,"Kate Morgenroth, Jude","breaking, hope, hopelessly-going-after-something, hopelessness"
I hope suffering don't exist.,"David Levithan, Dash & Lily's Book of Dares","hope, suffering"
***A KEY WORD*** Imagined,"Markus Zusak, The Book Thief","hope, imagine"
What is false about hope?,"Mitch Albom, The First Phone Call from Heaven","belief, faith, hope"
Great hopes make great men.,Thomas Fuller,hope
Hope without love is hopeless.,"Dejan Stojanovic, The Sun Watches the Sun","books, dejan-stojanovic, hope, hopeless, literature, literature-quotes, love, philosophy, poetry, poetry-quotes, poets, quotes, the-sun-watches-the-sun, wisdom"
Have faith in your beliefs,Michael Christos Zeis,"belief, faith, hope, life"
Please don't take my wings...,"Randall Wallace, Pearl Harbor","faith, hope, inspirational"
No rain can't get the rainbow.,ayumi hamasaki rainbow,"faith, hope, patience, trust"
Your tears are my prayers.,"Elizabeth Gilbert, Eat, Pray, Love","hope, inspirational, love"
The corpse opened his eyes.,"Donato Carrisi, The Lost Girls of Rome","death, evil, faith, good, hope, intruige, life, mystery, thriller"
"shit happens, miracles don't",Mohamed el airou,"hope, life, sadness, study"
Love must risk all or perish.,"Anthony  Ryan, Blood Song","dare, die, disappear, endeavor, fade, faith, hope, life, love, pain, perish, risk, try, war"
Hope is a gift. Use it wisely.,Harley King,"gift, hope, inspirational"
Hope can live in a vacuum.,"Greg Rucka, Star Wars: Guardians of the Whills",hope
This is what I know, people's hopes go on forever.,"Junot Díaz, This Is How You Lose Her"
Hope is a fine killing thing.,"Kirryn Lia Todd, Bruised Opulence","despair, hope"
Hope is only the love of life.,"Sally Brampton, Shoot the Damn Dog: A Memoir of Depression","hope, life, love-of-life"
Posture is Paramount.,"Cindy Ann Peterson, My Style, My Way: Top Experts Reveal How to Create Yours Today","branding, charisma, confidence, goals, hope, motivational, positivity, respect, style, wisdom"
God begets love.,Kamand Kojouri,"adage, aphorism, begets, beloved, christ, faith, god, harmony, hope, kamand, kamand-kojouri, kojouri, love, love-quotes, lover, oneness, religion, religious, simple-quotes, spiritual, spirituality, sufi, sufism, togetherness, union, unity"
Embrace the pain,"Jude Gibbs, Gifts from the Ashes: Hope in Jesus for Bereaved Parents","abuse, bareness, bereavement, child-loss, grief, hope, pregnancy-loss, rape, redemption, suicide"
We all die. Not all of us live.,"Edie Littlefield Sundby, The Mission Walker: I was given three months to live...","adversity-quotes, advice-for-daily-living, cancer, christian, courage, courage-quotes, death, death-quotes, empowering-quotes, empowerment, faith, faith-in-yourself, faith-quotes, fear, fear-quotes, god, god-s-grace, god-s-love, gods-grace, happy, happy-quotes, health, hope, hope-quotes, illness, illness-and-hope, inspirational, life, life-and-living, life-lessons, life-quotes, love, love-quotes, self-confidence, self-help, self-improvement, self-love, spiritual, spirituality, strength, strength-and-courage, strength-of-mind, strength-of-spirit, strength-of-will, strength-quotes, strength-through-adversity, walk, walker, walking, well-being, wellbeing, wellness, wisdom-quotes"
A mother is a dealer of hope.,Farshad Asl,"hope, mother"
"Today, death is your opponent.",Compton Gage,"books, death, education, faith, fear, funny, god, happiness, hope, humor, inspiration, inspirational, inspirational-quotes, knowledge, life, life-lessons, love, motivational, philosophy, poetry, relationships, religion, romance, science, spirituality, success, truth, wisdom, writing"
It is not enough to be a man.,Compton Gage,"books, death, education, faith, fear, funny, god, happiness, hope, humor, inspiration, inspirational, inspirational-quotes, knowledge, life, life-lessons, love, motivational, philosophy, poetry, relationships, religion, romance, science, spirituality, success, truth, wisdom, writing"
Hope is not undeniable, but it's always there. Hope is not invincible, but it keeps coming back.
A garden is made of hope.,"W.S. Merwin, What Is a Garden?","garden, gardening, hope"
Life is cold, I will put on my clothes and wear my shoes,Ernest Agyemang Yeboah
"Walk gently, and be brave.",Eleanor Brownn,"courage, faith, hope, lifelong-learning, love, self-care"
Dawn is ever the hope of men.,J.R.R. Tolkien,"dawn, hope"
"Here lies Dobby, a free elf.","J.K. Rowling, Harry Potter and the Deathly Hallows","death, epitaph"
Would it hurt to die?,"J.K. Rowling, Harry Potter and the Deathly Hallows",death
"Kill me, or you are a murderer.",Franz Kafka,"death, literature"
Death is contagious, it is contracted the moment we are conceived.,Madeleine L'Engle
I’ll never speak to God again.,Sylvia Plath,"death, depression"
Lord help my poor soul.,Edgar Allan Poe,"death, forgiveness, lord, mercy, soul"
All good things pass away.,"Philip Pullman, The Golden Compass","death, demise"
Today will die tomorrow.,Algernon Charles Swinburne,"death, future, present, time, today, tomorrow"
What glitters may not be gold, and even wolves may smile, and fools will be led by promises to their deaths.
Sometimes dead is better,"Stephen King, Pet Sematary","creed, dead, death, undead"
Death always wins.,"Kelly Creagh, Nevermore",death
An eye for an eye my friend.,Tsugumi Ohba,"anime, death, eye, fiction, friend, humor, l, lawliet, light, manga, note, yagami"
Got it. Demon. Death. Doom.,"Kami Garcia, Beautiful Creatures","death, humor"
Cover her face, mine eyes dazzle. She died young.,"John Webster, The Duchess of Malfi"
Justice will prevail!,Tsugumi Ohba,"anime, death, fiction, humor, justice, l, lawliet, manga, note, prevail, will"
The only certainty is death.,"Guy de Maupassant, Bel-Ami",death
The monster nevers dies.,"Stephen King, Cujo","death, monster"
A life is not a waste of time,"Nalini Singh, Angels' Blood","death, gratefulness, life, mortality, patience, time, waste"
"The rest, is silence.","William Shakespeare, Hamlet",death
I was tired of being me.,"Rachel Ward, Numbers","character, death, life, personality, self, suicidal-ideation"
Please don't die.,"Randy Pausch, The Last Lecture","death, humor, inspirational, love, science, tumor"
Death is not the end.,"Patrick Ness, Release","afterlife, death"
The Only Way Out Is To DIE!!!!,Bullet for My Valentine,"death, gothic, music"
Only.. I want to do die as myself,"Suzanne Collins, The Hunger Games","death, games, hunger, katniss, peeta, roof"
Death is perfectly safe. (55),"Stephen Levine, A Year to Live: How to Live This Year as If It Were Your Last","death, dying, safety"
Sleep: the stepchild of Death.,"Nancy A. Collins, In the Blood","death, sleep, sonja-blue"
"Love is bitter, death is sweet.","Jack Kerouac, Maggie Cassidy","death, life, love, poetry"
I'm not courting death, I've far too many books left to read.,"Alison Sinclair, Shadowborn"
In fact living is dying.,"Guy de Maupassant, Bel-Ami","death, life"
"We live, we love, we let it go.",Kevin Dalton,"death, life-and-death, love"
Forget it. Never explain, never apologize. You can either write posthumously or you can't.,"Christopher Hitchens, Prepared for the Worst: Selected Essays and Minority Reports"
Time erodes us all.,"Meg Rosoff, What I Was","aging, bodies, death, deterioration, time"
You can’t get the blood out.,"Steven Ramirez, Tell Me When I'm Dead","chaos, cheated, contagion, crazies, dead, death, drunk, hell-on-earth, horde, hordes, horror, horror-fantasy, na, new-adult, novel, paramilitary, paranormal-thriller, quarantine, revenge, soldier, soldiers, thriller, undead-thriller, weapon, weapons, zombie, zombie-apocalypse, zombie-horror, zombie-thriller, zombies"
His name was Theo.,"Cinda Williams Chima, The Gray Wolf Throne","death, han, loss, magret, name, ragger, theo, velvet"
"Live now, die later!","Stewart Home, The Art Strike Papers and Neoist Manifestos: The Years Without Art, 1990-1993","death, life, stewart-home"
Funerals aren't scheduled.,"Benjamin J. Carey, Barefoot in November","adversity, death, destiny, dying, funerals, life, living, strength"
Death preserves an ideal.,"Rosie Thomas, Iris & Ruby",death
I am dead man alive.,"Santosh Kalwar, I Am Dead Man Alive",death
Don't call it death, call it moving to Heaven.,Jacob Bowen
Carmen will always be free.,"Prosper Mérimée, Carmen","carmen, death, freedom"
Jango danced, and the tune that he danced to was Death.,"Cedric Nye, Jango's Anthem"
One death apiece is plenty.,Marty Rubin,death
The sky is not my limit...I am.,"T.F. Hodge, From Within I Rise: Spiritual Triumph Over Death and Conscious Encounters with ""The Divine Presence""","endurance, limits, persistence, quotes, self, sky, strength"
Do I look as pretty as I feel?,"Alexandra Bracken, Never Fade","alexandra-bracken, cole-stewart, liam-stewart, never-fade, quotes"
ღ¸.•* Love is Colorblind *•.¸ღ,M.G. Wells,"love, mgwells, quotes, quotes-to-live-by"
Love is holy.,"William Shakespeare, All's Well That Ends Well","holy, love, quotes, quotes-to-live-by, shakespeare"
Truth is irrelevant, what matters is what people believe.,"Henry Mosquera, Sleeper's Run"
You can't Google life,"Colin Tegerdine, You Can't Google Life",quotes
"Love is relentless, and so am I ;)",Keisha Keenleyside,"cheeky-quotes, funny-quotes, happy-quotes, humour-quote, love-quotes, quotes"
Be the winner in your life!,"Tae Yun Kim, Seven Steps to Inner Power","ebooks, inspirational, quotes, self-esteem, winner"
Threatened men live long.,"Rudyard Kipling, Puck of Pook's Hill","common-sense, oliviu-craznic-selected-quotes, prudence, quotes, quotes-about-life, quotes-to-live-by"
Stories You Can Feel!,"Corey Aaron Burkes, Scratch - with Audio Theater and Links","corey-burkes, desktopepics, quotes"
Sleep is death enjoyed.,Friedrich Hebbel,"life, literature, personal, quotes"
Anybody can fail.,"M.G. Hardie, It Ain't Just The Size","mg-hardie, quote, quotes"
Feels so good to be quoted,Malebo Sephodi,"author, black-woman-author, quotes, writer-s-life, writers-on-writing"
You can't break the broken.,"Margarete Cassalina, See You at Sunset","fiction-novel, quotes, quotes-about-life"
Don’t beg for treasure, create it for yourself. Don’t beg for positions, build one for yourself.
Don’t beg for attention, pay attention to your dreams and others will pay attention to you.,"Israelmore Ayivor, 101 Keys To Everyday Passion"
You are loaded with answers, don’t live your entire life asking questions.,"Israelmore Ayivor, 101 Keys To Everyday Passion"
Love does not judge.,Madeleine L’Engle,"quotes, quotes-about-life, quotes-on-life-and-purpose, quotes-to-live-by"
Da shit you say!,"Brian   Cook, The Thin Blue Line: Perception is Deception","quotes, shit-happens, shitty-situation"
The truth will set you free.,"Gary L. Stewart, Susan Masfasa","quotes, quotes-about-life, quotes-to-live-by"
Work hard but work smart.,Chris Mentillo,"best-quotes-favorite-quotes, chris-mentillo, chris-mentillo-books, chris-mentillo-goodreads, chris-mentillo-horror, chris-mentillo-horror-books, chris-mentillo-quotes, classic-quotes, doc-mentillo, dr-chris-mentillo, dr-mentillo, famous-author-quotes, famous-authors, famous-people, famous-quotes, good-and-evil, goodreads, goodreads-author, goodreads-authors, goodreads-member, goodreads-quote, goodreads-quotes, horror, horror-authors, horror-fiction, horror-genre, horror-writer, mentillo, mentillo-quotes, quotes, quotes-from-authors-0-likes, tags"
"Be the decision, not ego.",Avishek Mondal,"decision, decision-making, decisions-and-actions, decisions-in-life, decisions-inspirational, quotes"
I don't get bad bitches, I make them.,Slicktor Victor Robinson
What a MOTHER means,Multitask PersonaOverwork beingTender heartedness humanEncourages peopleReliable friend,WISDOM KWASHIE MENSAH (WKM)
Love her but leave her wild ,"Atticus Poetry, Love Her Wild: Poems","atticus, atticus-poetry, atticuspoetry, her, instagram, love, love-her-wild, poems, poetry, quotes, wild"
Time is all we have and don’t. ,"Atticus Poetry, Love Her Wild: Poems","atticus, atticus-poetry, atticuspoetry, her, instagram, love, love-her-wild, poems, poetry, quotes, wild"
I am not a titleholder, I don't steal, I don't lie...
Honest is great legacy.,Fozia Malik,quotes
The truth hurt more than lies.,"Melissa Landers, Starfall","lies, melissa-landers, quotes, starfall, truth"
You will forever be my always.,"Swapna Rajput, The Beautiful Roses","love, lovequotes, quotes, romance"
Don't breathe to survive, dance and feel alive.,Shah Asad Rizvi
You are like a narcotic plant.,"Olga Goa, Fateful Italian Passion","dark-romance, erotic-romance, fateful-italian-passion, italian, love, love-quotes, passion, quotes, romance, series, series-romance"
Even dirty water has a bath,R.W. Erskine,"bath, dirty, quotes, water"
Magical since Birth.,Stephanie Lahart,"black-girl-magic, black-girls, black-girls-are-magic, black-girls-rock, black-woman, black-women-quotes, quote, quotes, stephanie-lahart, stephanie-lahart-quotes"
SHE Can. SHE Does. SHE Wins.,Stephanie Lahart,"black-girl-magic, black-girl-power, black-girl-quotes, black-girls-rock, empowering-girls, empowering-women, feminist-quotes, girl-empowerment, girl-power, power-women, quote, quotes, smart-girls, stephanie-lahart, stephanie-lahart-quotes, women-empowerment"
Keep Moving Forward,Meet the Robinsons,"disney, inspirational, keep-moving-forward, meet-the-robinsons, movies, quotes, so-true"
Youth is to venture, age is to love nature and reflect.,Debasish Mridha
Hatred imprisons the haters, love opens doors.,Debasish Mridha
Action achieves ambition.,"Amit Kalantri, Wealth of Words","achieve, achieves, act, action, adage, advertisement, alliterations, ambition, ambitious, amit-kalantri, amit-kalantri-quotes, amit-kalantri-writer, blog, blogging, book-writing, catch-lines, catchphrases, characters, creative-writing, efforts, essay, goal, goals, hard-work, inspirational, karma, knowledge, motivational, movie, movie-dialogue, novel-writing, philosophy, proverbs, public-speaking, punchline, quotes, rhetoric, script, script-writing, scriptwriting, social-networking, speech, speechwriting, story, tag-lines, taking-action, taking-steps, targets, try, trying, wisdom, wishes, writing"
Bitch inside innocence...!!!,M.Rehan Behleem,"bitch, innocence, quotes"
Cool down and think.,Istiak Ahmed,quotes
You don’t need to be perfect, just be yourself.,Debasish Mridha
Life dances on the moment.,Debasish Mridha,"debasish-mridha, debasish-mridha-md, everything-changes-in-a-moment, inspirational, life, life-dances, philosophy, quotes"
Give life a purpose to pursue.,Debasish Mridha,"debasish-mridha, debasish-mridha-md, give-life-a-purpose, inspirational, philosophy, pursue, pursue-life, quotes"
Dream more to live more.,Debasish Mridha,"debasish-mridha, debasish-mridha-md, dream, dream-more, inspirational, live-more, philosophy, quotes"
Time is always ready.,Debasish Mridha,"debasish-mridha, debasish-mridha-md, inspirational, passage-of-time, philosophy, quotes, time, time-is-always-ready"
Dare to blaze.,Lana M. H. Wilder,"blaze, dare, daring, lana, lana-m-h-wilder, lana-wilder, quote, quotes"
Never forget to smile, always forget to frown.,Debasish Mridha
"LOVE is, can, and will.",Stephanie Lahart,"inspirational-love-quotes, love-is, love-is-quotes, quote, quotes, quotes-about-love, stephanie-lahart-quotes"
Don’t fear criticism, fear stagnation.,Debasish Mridha
Always be ready to help, never exercise your right to criticize.,Debasish Mridha
No one can give you freedom, you only find it when you learn to overcome your fears.,Debasish Mridha
Love is the beauty, love is the truth. Love is the creative and sustaining energy of life,Debasish Mridha
"Feel special, because you are.",Debasish Mridha,"debasish-mridha, debasish-mridha-md, feel-special, inspirational, philosophy, quotes, you-are-special"
Embrace the wonder,Lynette Noni,"alex, embrace, library, lynette-noni, quotes"
